index,lower_description
160,"apply knowledge and know‐ how of data science to applications pertinent to subject matter experts at mda. collaborate with business units and end‐ users to create compelling and accurate data presentations based on the entire data analytics and reporting service suite. design and prototype data ingestion, cleaning, curation, storage and retrieval, concentrating particularly on analytics, statistical modeling, dissemination and presentation. work with developers and data analysts from the data analytics team to build and maintain end‐ to‐ end user capabilities and interface based on business functional and performance requirements other duties as assigned, apply knowledge and know‐ how of data science to applications pertinent to subject matter experts at mda. collaborate with business units and end‐ users to create compelling and accurate data presentations based on the entire data analytics and reporting service suite. design and prototype data ingestion, cleaning, curation, storage and retrieval, concentrating particularly on analytics, statistical modeling, dissemination and presentation. work with developers and data analysts from the data analytics team to build and maintain end‐ to‐ end user capabilities and interface based on business functional and performance requirements, high school diploma or ged and 20 years general experience, or an associate degree and 18 years general experience, or bs degree and 16 years general experience, or a ms degree and 14 years general experience requires 14 years directly related experience; related experience must be in one or more of the following: java, microsoft certified solutions developer mcsd, elasticsearch elk stack or other big data ecosystem, cloudera, kafka, linux redhat, sql, json, c++, python, r, c#, ruby, agile methodologies, adobe certified expert ace must have strong interpersonal skills and writing ability commensurate with programming skills, mathematical skills and statistical background candidate must possess a comptia security+ with ce or higher or able to obtain certification within 30 days must be a us citizen and must be able to obtain and maintain an active dod secret clearance, high school diploma or ged and 20 years general experience, or an associate degree and 18 years general experience, or bs degree and 16 years general experience, or a ms degree and 14 years general experience, requires 14 years directly related experience; related experience must be in one or more of the following: java, microsoft certified solutions developer mcsd, elasticsearch elk stack or other big data ecosystem, cloudera, kafka, linux redhat, sql, json, c++, python, r, c#, ruby, agile methodologies, adobe certified expert ace, must have strong interpersonal skills and writing ability commensurate with programming skills, mathematical skills and statistical background, candidate must possess a comptia security+ with ce or higher or able to obtain certification within 30 days, must be a us citizen and must be able to obtain and maintain an active dod secret clearance, experience developing processes and training and cloud based system architectures and related tool experience in large development initiatives, developing high volume database applications, data warehousing, complex shell scripting, agile methodology and publicor private cloud experience experience with cloudera, kafka, logstash, redhat, sql, json, c++, python, r, c#, ruby, agile methodologies, adobe certified expert ace."
161,"logistics done differently. at xpo logistics, we know that the ability to capture and analyze data will help us to transform the logistics industry which means we need highly skilled people who love data. as the data scientist, you will be responsible for data wrangling, advanced programming, and statistical analysis machine learning and data mining. we need you to take complex data, analyze it, draw meaningful conclusions, and communicate the findings in a manner that can be easily understood. in this role, you have the ability to positively affect xpo’s future through advice and counsel. pay, benefits and more. we are eager to attract the best, so we offer competitive compensation and a generous benefits package, including full health insurance medical, dental and vision, 401k, life insurance, disability, and the opportunity to participate in a company incentive plan. what you’ll do on a typical day:, work with leadership to understand needs and align those to potential data and analytics efforts gather and integrate data from various sources for use in advanced analytics efforts identify, analyze, and interpret trends, patterns, and relationships in complex data sets using advanced analytics tools and models prepare findings in a professional manner, presenting on results and providing actionable recommendations to leadership promote a data-driven culture through ongoing partnership and dialog with the business, what you need to succeed at xpo:, at a minimum, you’ll need:, bachelor’s degree in statistics, mathematics, data science, economics, physics, or analytics related field 1 year of experience in quantitative analytics proficiency with microsoft office word, excel, and power bi, d3.js, python, and r strong knowledge of database design, data models, and integration/extraction technologies strong knowledge of statistics and experience using statistical modeling logistic regression, svms, etc. to solve business problems knowledge of statistical modeling techniques: linear/logistic regression including advanced predictor selection techniques, classification decision trees, random forests, support vector machines svms, neural networks, etc. it’d be great if you also have:, master’s degree in data science or related field 5 or more years of experience in quantitative analytics experience with text analytics e.g. semantic analysis strong analytical skills with the ability to collect, organize, analyze, and disseminate information with attention to detail and accuracy, be part of something big. xpo provides cutting-edge supply chain solutions to the world's most successful companies, including disney, pepsi, l'oréal, toyota and many others. we’re the fastest-growing transportation company on the fortune 500 list and we’re just getting started. we are proud to be an equal opportunity/affirmative action employer. qualified applicants will receive consideration for employment without regard to race, sex, disability, veteran, or other protected status. the above statements are intended to describe the general nature and level of work being performed by people assigned to this classification. they are not intended to be construed as an exhaustive list of all responsibilities, duties, and skills required of personnel so classified. all employees may be required to perform duties outside of their normal responsibilities from time to time, as needed."
162,"primary location: united states,new york other location: united states,new york,new york education: bachelor's degree job function: technology schedule: full-time shift: day job employee status: regular travel time: no job id: 18019647, ability to build risk or forecasting models with a hands-on appreciation of data complexity, volume, and domain structured and unstructured such as that found in large financial and banking institutions self sufficient in generating machine learning models with a custom tool set, such as creating their own java code, leveraging open source libraries or academic papers, or using matlab familiarity with hadoop preferably cloudera and its tools, such as spark, impala, udf for hive etc. be capable to match data labels to the participant information and any derived behavioral features, as these will be sourced from different systems without clear match keys be inquisitive and research-oriented, and try several machine learning approaches for this project, such as decision trees, factorization models, and deep learning at a minimum, and other techniques as desired define key performance indicators to measure model accuracies and project success based on business goals. be accountable to the overall quality of models developed must be able to write everything up, including detailed comparisons of model performance against the success criteria, and functional requirement documents that will be used to scale this project to a global firm-wide implementation have excellent communication skills and be comfortable working in a large matrix environment be prepared to work fully within citi’s infrastructure due to data privacy and security concerns and could not export the data or any documentation to an external cloud service or their own personal devices. must to be accessible during regular business hours for meetings, workshops, and collaboration; even though working from university site and remote is expected. bachelors degree in computer science or a related field of study"
163,"sr. data scientist, why catalina, catalina’s personalized digital media connects shoppers to the brands we know they want. we do this by delivering only the most relevant ads and offers from their home to the aisle. and only catalina knows the evolving purchase history and individual needs of more than three-quarters of 280 million american shoppers. with the world’s largest shopper purchase history database driving all personalized media across our networks, catalina drives lift and loyalty for the world’s leading cpg brands and retailers. we target consumers with the right behavior-based message when it’s most impactful via the channel that’s most likely to reach them — digital or in the store. our team, the advanced analytics and data science team at catalina operates near the tip of spear, creating new, world-class science-based capabilities for external and internal clients, shepherding these initiatives from initial concept, prototyping / proof-of-concept, design, build, testing, training, and handoff. we use advanced machine learning, data science, operations research, statistics, and related analytics methodologies, operating on big data and delivered on a scalable computing platform using modern technologies. we illustrate value and drive to bring these capabilities to initial production and ensure that these initiatives are successful when we hand off. this position will report directly to the vp of advanced analytics and data science. what you will be doing, the incumbent will, work on complex projects that require subject matter expertise across multiple functional areas, operations or processes formulates complex mathematical models in an appropriate programming language or application analyzes raw input data from computer or other media leads project planning sessions with clients, business analysts, and team members to gather and analyze user requirements. develops business case analysis to support recommendations validates and tests of models to ensure adequacy, or determines need for reformulation facilitates the design, development, and planning of viable solutions to complex business problems according to user specifications. complies with project methodology requirements utilizes and stays current on applicable programming languages and software technologies track progress and report out to stakeholders provides direction, tools and process support to less senior associates know what quality means, strive for quality, design for quality, test and refine until a very high quality is achieved, and continuously improve deliver prototypes / proofs of concept recommend plans to bring to production, what you bring to the team, ph.d. in machine learning, computer science, engineering, mathematics, statistics, operations research, or related discipline and 2+ years’ experience after graduate school in computation, data science, machine learning or related; or masters degree in same disciplines mentioned above and 4+ years’ experience; or bachelor degree and 6+ years’ experience, computing skills: programming e.g. c++, cloud distributed computing, python / r, machine learning frameworks e.g. sk-learn, tensorflow, linux, bitbucket, target process/jira or other issue-tracking good communications, verbally, and also have ability to construct cogent design documents, emails and powerpoints atlanta-based ability to travel up to 25%, additional preferred skills, sunny disposition, team player academic networking, catalina core values, be a trusted partner : act with integrity and positive intent, focus on the customer: keep the needs of both internal and external customers as well as, consumers front and center, act like an owner: think holistically about how your role helps fulfill our mission, be innovative: share and scale the best ideas regardless of origin, strive for simplicity: add meaning and eliminate complexity, value personal and professional growth: contribute to an environment that enables, individual, team and organizational success, the intent of this job description is to describe the major duties and responsibilities performed by incumbents of this job. incumbents may be required to perform other job-related tasks other than those specifically presented in this description. all duties and responsibilities are essential job functions and requirements and are subject to possible modification to reasonably accommodate individuals with disabilities. we are proud to be an eeo employer m/f/d/v. we maintain a drug-free workplace. note to recruiters and placement agencies : we do not accept unsolicited resumes from outside recruiters /placement agencies. catalina will not pay fees associated with resumes presented through unsolicited means."
164,"the universities space research association usra has a mission to advance space-related sciences and exploration through innovative research, technology, and education programs that involve universities, governments, and the private sector for the benefit of humanity. supporting that mission, the usra research institute for advanced computer science riacs collaborates with the data science group at nasa’s ames research center to support the goal of better organizing, extracting and presenting relevant information buried in a variety of large real-world data sets using machine learning techniques. position summary :, the machine learning data scientist will conduct applied research and development on the application machine learning techniques to a portfolio of nasa applications with focus on aeronautics applications. the position will work with other data science team members, and serve as technical lead for a portfolio of projects related to aeronautics applications. the position will also be involved with development of proposals for new collaborations involving both academia and industry, for joint public-private initiatives to address key national challenges. essential duties/responsibilities :, satisfy usra's non-profit mission my making a distinctive impact through scientific and technical accomplishments in the assigned research projects. support goal to better organize, extract and present relevant information buried in a variety of large real world data sets requires familiarity with efficient data manipulation techniques with various data mining and machine learning methods applied to “big data”, data with large volume, high velocity, high variability and changing definitions be familiar with typical “applied data mining research”: assessment of existing methods’ suitability for application for targeted problem, articulate inadequacies in methods if any exist formulate and develop new methods or modifications of existing methods for targeted problems document new methods in form of technical reports and peer reviewed publications ensure transparency of algorithms to user experience; develop software and visualization modes of presentation and interaction, assessment of existing methods’ suitability for application for targeted problem, articulate inadequacies in methods if any exist, directly perform, and publish, research at the highest standards as a pi, co-i and as a member of larger research projects. plan, schedule, and conduct activities in all phases of research projects, as a pi or co-i and as a member of a larger research team. assess suitability of different methods for targeted applications, and develop new methods and embody in software implementations as needed. prepare research results for publication in reports, papers, journals, books, and other media. engage academic, industrial, and government research communities in collaborative research through activities such as seminars and other talks, workshops, and conferences. prepare and deliver briefings and presentations to various national and international seminars, talks or lectures for dissemination of knowledge including educational outreach. write several publications of considerable interest and value to the field as evidenced by favorable reviews, by citation in the work of others, by presenting papers to professional societies, and/or will have contributed inventions, new designs or research, which are of material significance in the solution of important applied problems. engage the academic community in research work through research collaborations, visits, invited guests, workshops, conferences, etc. act as a mentor for student interns involved in machine learning research. maintain an awareness of funding opportunities, and seek and obtain funding to ensure continued growth of the impact of the group’s research efforts. develop an awareness of nasa’s mission needs and address them to the best of ability. maintain an awareness of funding opportunities in area of expertise through internal and external funding agencies; seek and obtain funding to ensure continuation and growth of research efforts. serve as a pi or co-i on proposal submissions to funding opportunities. prepare reports of your scientific and other activity for purposes of periodic reports to nasa and usra management, including for self-evaluation for annual performance appraisals. support strategic planning and annual metrics reporting including analyzing and anticipating relevant research trends and their implications, and for program development including efforts to broaden and strengthen the nasa relationship and to diversify the sponsor/customer base. continue to learn and develop skills and expertise including completing all trainings as scheduled. other job duties as assigned, plan, schedule, and conduct activities in all phases of research projects, as a pi or co-i and as a member of a larger research team. assess suitability of different methods for targeted applications, and develop new methods and embody in software implementations as needed. prepare research results for publication in reports, papers, journals, books, and other media. prepare and deliver briefings and presentations to various national and international seminars, talks or lectures for dissemination of knowledge including educational outreach. write several publications of considerable interest and value to the field as evidenced by favorable reviews, by citation in the work of others, by presenting papers to professional societies, and/or will have contributed inventions, new designs or research, which are of material significance in the solution of important applied problems. engage the academic community in research work through research collaborations, visits, invited guests, workshops, conferences, etc. act as a mentor for student interns involved in machine learning research. develop an awareness of nasa’s mission needs and address them to the best of ability. maintain an awareness of funding opportunities in area of expertise through internal and external funding agencies; seek and obtain funding to ensure continuation and growth of research efforts. serve as a pi or co-i on proposal submissions to funding opportunities. support strategic planning and annual metrics reporting including analyzing and anticipating relevant research trends and their implications, and for program development including efforts to broaden and strengthen the nasa relationship and to diversify the sponsor/customer base. required qualifications, education:, ph.d. degree in data science, computer science or a related discipline, desired experience:, at least five years of experience applying machine learning techniques to the aeronautics domain a strong track record of research success as evidenced by publishing related work in peer reviewed journals, and contributing to obtaining new funding in the areas above. excellent organizational and communication skills. experience as a principal investigator pi, knowledge, skills and abilities:, ability to work independently and effectively as part of a multidisciplinary team. ability to prioritize tasks, coordinates work of others, and meets multiple deadlines. ability to communicate through conference presentations and scientific publications is essential. ability to propose credible and innovative research projects, develop the necessary skills to perform the work, and carry out the research, providing the required reporting to the granting agency in a timely fashion. ability to interpret usra and federal policies and procedures necessary to function in a scientific research environment that is enabled through u.s. government funds. advanced experimental and analytical skills. working conditions :, this job operates in a professional office environment. this role routinely uses standard office equipment such as computers, phones, photocopiers, etc. keyboarding for large time spans each day will be a significant part of this position. this is largely a sedentary role. travel:, employee must be willing and able to travel. position may require domestic and international business travel. applicants should apply to the posting at https://usracareers.silkroad.com/ and include a letter of interest, resume, or curriculum vita. review of candidates will begin immediately. additional information on usra can be found at www.usra.edu . usra is an equal opportunity employer minorities/females/protected veterans/disabled/sexual orientation/gender identity"
